{
  "$schema": "https://json-schema.org/draft/2020-12/schema",
  "title": "truss eval case",
  "description": "One golden case for the QC engineer or checking engineer prompt, one per file at evals/golden/<id>.json. Truss ADR-0007, section 2.",
  "type": "object",
  "additionalProperties": false,
  "required": ["id", "source", "role", "input", "expected"],
  "properties": {
    "id": {
      "description": "Lowercase words of letters and digits joined by single hyphens; equals the file name without .json.",
      "type": "string",
      "pattern": "^[a-z0-9]+(?:-[a-z0-9]+)*$"
    },
    "source": {
      "description": "The run file the case came from, .git/truss/<run-id>/<path>, relative to the git common dir: strip .git/ and resolve against git rev-parse --git-common-dir. Forward slashes; no segment starts with a dot, so no .. and no absolute path.",
      "type": "string",
      "pattern": "^\\.git/foundry/[0-9a-f]{8}(?:-[0-9a-f]{4}){3}-[0-9a-f]{12}/(?:[A-Za-z0-9_][A-Za-z0-9._-]*/)*[A-Za-z0-9_][A-Za-z0-9._-]*$"
    },
    "role": {
      "enum": ["qc", "checker"]
    },
    "input": {
      "description": "The brief handed to the role, verbatim. A QC input has no line starting VERDICT:; a checker input never contains RECOMMEND.",
      "type": "string",
      "minLength": 1
    },
    "expected": {
      "type": "object",
      "additionalProperties": false,
      "required": ["keyword", "kind"],
      "properties": {
        "keyword": { "enum": ["VERDICT", "RECOMMEND"] },
        "kind": { "enum": ["PASS", "FAIL", "answer", "defer", "pass"] }
      }
    }
  },
  "allOf": [
    {
      "if": { "properties": { "role": { "const": "qc" } }, "required": ["role"] },
      "then": { "properties": { "expected": { "properties": { "keyword": { "const": "VERDICT" }, "kind": { "enum": ["PASS", "FAIL"] } } } } }
    },
    {
      "if": { "properties": { "role": { "const": "checker" } }, "required": ["role"] },
      "then": { "properties": { "expected": { "properties": { "keyword": { "const": "RECOMMEND" }, "kind": { "enum": ["answer", "defer", "pass"] } } } } }
    }
  ]
}
