{
  "id": "judge-foundry-protocol-2",
  "source": ".git/foundry/40816bb1-1ec8-4755-8d97-0d12599e1e84/reports/foundry-protocol/foundry-protocol-judge-2.md",
  "role": "qc",
  "input": "Rule on the work of the crew \"foundry-protocol\" against its goal and done-check.\n\nBase: 54f0d68\nHead: f256cad9fada4c61a30b45591dc35bd1a6c78175\n\nGoal file (goals/foundry-protocol.md):\n\n# Crew `foundry-protocol` (wave 1, verdict `change`)\n\n**Goal.** Change foundry's crew protocol so runs leave no leftovers, per ADR-0015 (`docs/adr/0015-agent-worktree-cleanup.md`) and foundry ADR-0004 as amended. Make every case in `plugins/foundry/tests/contract-roles.test.ts` (cases 18-21) pass without editing that file or `tests/fixtures/roles/**`. The run's goal is in `plan.json`.\n\nWhat to build:\n\n- **The merge contract** (ADR-0015 §11). `agents/lead.md` section 12 and the run skill's merge steps (`skills/run/SKILL.md`, the \"make ready\" and sequential-merge passages): the lead merges the target into the crew branch with `git merge <target>` and its members' branches with real merges, never a rebase or cherry-pick, so member SHAs stay ancestors. The foreman still runs `git merge --ff-only`. The Branch line's `<base>` is \"the target head last merged in\", per ADR-0004 as amended.\n- **judge.md** keeps the bare `Head:` and `Patch:` template lines and the \"nothing after but spaces or tabs\" rule.\n- **`tests/gates.check.ts`** gains a real test that rejects a `Head:` line with a trailing note, and pins the bare template lines in `agents/judge.md`. The crew's Sonnet test-writer writes it.\n- **The plan-file route** (ADR-0015 §9, contract cases 18-21) in `hooks/`: only a `foundry:architect` the foreman spawned outside any crew with a prompt starting `Mode: plan` gets its plan written; the hook writes `plan.json` and `plan.md` to `<git common dir>/foundry/<session>/` from the architect's hand-back (the two four-backtick blocks); a plan whose `approvedAt` is set is never overwritten (log `foundry: plan-file route kept the existing plan: ...`); the written plan has `approvedAt: null`; it is validated with `parsePlan` before writing, and nothing is written when invalid (log `foundry: plan-file route wrote nothing: ...`). Update `agents/architect.md` plan mode to hand the plan back in that shape.\n- **The no-check-code rule.** `agents/architect.md` and `skills/run/SKILL.md` gain: \"The architect never writes check code; a done-check is a test command; a check that needs logic is a contract test written by a crew's Sonnet test-writer.\"\n- **Owner model rules** in `agents/lead.md` and `skills/run/SKILL.md`: replace \"tricky code → Opus\" wording (lead.md around 78, SKILL.md around 142) so no Opus member writes code or does a checkout; Opus is for judges, red teams, writers and the architect, at effort medium.\n- **No declaration producer.** The owner chose worktrees' `noIsolateAgents` (P33). The init skill's existing `noIsolateAgents` advice stays; you may update it to name `foundry:judge,foundry:cynic`.\n- **README and version** above 0.5.1 in `.claude-plugin/plugin.json`; the README covers retro's new `leftovers` key (built by `foundry-retro`) in one line.\n\n**Done-check** (proved red only after wave 0 merged; wave 0 is merged at `b7f9593`, main is now `ddc124a`). Re-run it in your worktree before any member starts, and record the failing case names in your report:\n\n```\ntest -f plugins/foundry/tests/contract-roles.test.ts && claude plugin test plugins/foundry && node --test plugins/foundry/tests/*.check.ts && claude plugin validate plugins/foundry && node -e \"const [a,b,c]=require('./plugins/foundry/.claude-plugin/plugin.json').version.split('.').map(Number);console.log('foundry',a,b,c);process.exit(a*1e6+b*1e3+c>5001?0:1)\"\n```\n\nOn main after wave 0 the foreman saw 372 pass / 8 fail in `claude plugin test plugins/foundry`.\n\n**Notes from the design crew:** contract-roles relies on the Agent result id `new1` and on unprefixed `ui.log` text; read the test's mock before building.\n\n**Owns:**\n\n- `plugins/foundry/agents/**`\n- `plugins/foundry/skills/run/**`, `plugins/foundry/skills/init/**`\n- `plugins/foundry/hooks/**`\n- `plugins/foundry/tests/gates.check.ts`, `plugins/foundry/tests/roles.test.ts`\n- `plugins/foundry/README.md`, `plugins/foundry/.claude-plugin/plugin.json`\n\n**Must not touch:** `plugins/foundry/tests/contract-roles.test.ts`, `tests/test_contract_*.py`, `tests/fixtures/**` (wave 0's contract), `plugins/foundry/scripts/**` and `skills/retro/**` (`foundry-retro`), `plugins/foundry/docs/**` including ADRs and `backlog.md`, and everything outside the list above.\n\n**High-impact paths:** `plugins/foundry/hooks/register.ts` (the plan-file route writes into the foundry dir); the merge steps in `lead.md` and `skills/run/SKILL.md`, which gate what reaches main.\n\n**Red team: yes** (`foundry:judge` in red-team mode, Opus, medium), on `hooks/register.ts` and the plan-file route. It must try: an architect spawned from inside a crew; `Mode: design` and `Mode: init`; a non-architect type carrying a plan block; an approved plan on disk; a hand-back with a malformed, missing or extra block; a plan whose `approvedAt` is already set in the carried block; a path in the plan that could steer a write outside the foundry dir.\n\n**Judge checks** (the done-check can't see these): no \"rebase\" or \"cherry-pick\" instruction left in the lead's or foreman's merge steps; the no-check-code rule's text is in both `architect.md` and `skills/run/SKILL.md`; no \"tricky code → Opus\" wording left; the diff touches no wave-0 contract file or fixture; no `skip`/`todo` added.\n\n**Members** (planned, 7 agents including the lead): test-writer (`kit:test-writer`, sonnet, medium) for the `gates.check.ts` pin and any `roles.test.ts` additions; builder (`kit:builder`, sonnet, medium) for the plan-file route in `hooks/`; writer (`foundry:writer`, opus, medium) for `lead.md`, `architect.md`, `judge.md` if needed, the run and init skills, README, plus the version bump; red team; judge (`foundry:judge`, opus, medium); one repair judge. Skills: `technical-writer` for the writer (writingSkill: unset in `.claude/foundry.json`; the writer loads the best one it finds).\n\n**Resources:** no database, no temp dir (engine mocked). ports: none (no .claude/worktree-setup.*; worktrees gives no PORT_BASE).\n\n**Architecture doc:** `docs/architecture.md`, `plugins/foundry/docs/architecture.md`. **ADRs:** `docs/adr/0015-agent-worktree-cleanup.md` (this run), `plugins/foundry/docs/adr/0004-scope-repair-and-head-gates.md` (amended this run), ADR-0005.\n\nPrompt overrides: none\n\nMembers' reports named: none.\n\nDone-check output (as quoted by the judge file): none quoted.\n",
  "expected": {
    "keyword": "VERDICT",
    "kind": "PASS"
  }
}
