{
  "id": "cynic-answer-case-fold",
  "source": ".git/foundry/40816bb1-1ec8-4755-8d97-0d12599e1e84/decisions.md",
  "role": "checker",
  "input": "Decision text: Design QUESTION, case-folded qualified match: accepted as written.\nCitation: today's needsWorktree case-folds; ruling was qualified vs bare\n",
  "expected": {
    "keyword": "RECOMMEND",
    "kind": "answer"
  }
}
