{
  "id": "cynic-defer-log-promise",
  "source": ".git/foundry/70917104-1578-48f5-8ac2-f9e48814b8cc/decisions.md",
  "role": "checker",
  "input": "Decision text: a rejecting $.ui.log promise goes unhandled in safely/failOpen and other call sites; predates this diff; wrap as register.ts:1165 does, with a test\n",
  "expected": {
    "keyword": "RECOMMEND",
    "kind": "defer"
  }
}
