{
  "id": "judge-roles-1",
  "source": ".git/foundry/40816bb1-1ec8-4755-8d97-0d12599e1e84/reports/roles/roles-judge.md",
  "role": "qc",
  "input": "Rule on the work of the crew \"roles\" against its goal and done-check.\n\nBase: 5831f1b\nHead: 8fe82e3cbec3fc7a743a09326aae51cf4b4815b7\n\nGoal file: none in goals/ for this crew.\n\nMembers' reports named: none.\n\nDone-check output (as quoted by the judge file): none quoted.\n",
  "expected": {
    "keyword": "VERDICT",
    "kind": "FAIL"
  }
}
