{
  "id": "cynic-pass-seam-route",
  "source": ".git/foundry/40816bb1-1ec8-4755-8d97-0d12599e1e84/decisions.md",
  "role": "checker",
  "input": "Decision text: the seam route is the owner's call: a worktrees skill (channel 4) or a request file a worktrees hook acts on (channel 2), both inside P1, vs a path file foundry runs from, which amends ADR-0001\n",
  "expected": {
    "keyword": "RECOMMEND",
    "kind": "pass"
  }
}
