{
  "id": "judge-retro-causes-1",
  "source": ".git/foundry/70917104-1578-48f5-8ac2-f9e48814b8cc/reports/retro-causes/retro-causes-judge.md",
  "role": "qc",
  "input": "Rule on the work of the crew \"retro-causes\" against its goal and done-check.\n\nBase: 65cc2b6\nHead: 8fe3925bf836f68dd041204a4ac22ba7033d6110\n\nGoal file (goals/retro-causes.md):\n\n# retro-causes\n\nGoal: carry out foundry ADR-0006 in retro. `plugins/foundry/scripts/retro.py` emits the new top-level key `leftoverDetails`, exactly as ADR-0006 and `tests/test_contract_leftover_details.py` define it, with `leftovers` and every other key unchanged. `plugins/foundry/skills/retro/SKILL.md` gains the bounded root-cause step (`CAUSE: <anomaly> | <evidence> | <fix location>`, one line per non-zero leftover, judge fail, stall, overrule or spent budget, never spawns over estAgents; sources limited to git, the disk, decisions.md, judge VERDICT/finding lines and plugin files; never message, prompt or report bodies; plugin-level causes reported to the owner as plugin findings, never written). It also reports `leftoverDetails`, and its description's \"why crews stalled or got rejected\" gets a body step behind it.\n\nWave: 1. Verdict: change (module retro).\n\nDone-check:\n\n```\npython -m unittest discover -s plugins/foundry/tests && node --test plugins/foundry/tests/retro-cause.check.ts\n```\n\nIt is proved red only after wave 0 (leftover-design) merges. The lead re-runs it before any member starts, and it must fail on the new key and the CAUSE literals.\n\nOwns:\n- plugins/foundry/scripts/retro.py\n- plugins/foundry/skills/retro/SKILL.md\n- plugins/foundry/tests/test_retro_leftover_details.py (new, its own edge tests)\n\nMust not touch: the contract tests, ADRs and architecture docs (leftover-design's), or judge.md, lead.md, README.md, plugin.json (redteam-reset's). Never import or call the worktrees plugin. retro.py stays read-only on the repo.\n\nHigh-impact paths: plugins/foundry/scripts/retro.py (runs git inside other agents' worktrees; must stay read-only).\n\nRed team: no.\n\nResources: no database. Temp dir: `tempfile.mkdtemp` per test. ports: none (no .claude/worktree-setup.*; worktrees gives no PORT_BASE).\n\nArchitecture doc: docs/architecture.md and plugins/foundry/docs/architecture.md. This run's ADR: plugins/foundry/docs/adr/0006-leftover-causes.md (foundry ADR-0006). Plan: plan.md and plan.json in this foundry dir.\n\nPrompt overrides: none\n\nMembers' reports named: none.\n\nDone-check output (as quoted by the judge file): none quoted.\n",
  "expected": {
    "keyword": "VERDICT",
    "kind": "PASS"
  }
}
