{
  "id": "cynic-defer-init-drops-goal",
  "source": ".git/foundry/70917104-1578-48f5-8ac2-f9e48814b8cc/decisions.md",
  "role": "checker",
  "input": "Decision text: /foundry:init <goal> with a doc present skips to step 5 and drops the goal silently (skills/init/SKILL.md:22); tell the owner plan time covers it, or run an extend pass\n",
  "expected": {
    "keyword": "RECOMMEND",
    "kind": "defer"
  }
}
