{
  "id": "judge-fetch-gate-1",
  "source": ".git/foundry/70917104-1578-48f5-8ac2-f9e48814b8cc/reports/fetch-gate/fetch-gate-judge.md",
  "role": "qc",
  "input": "Rule on the work of the crew \"fetch-gate\" against its goal and done-check.\n\nBase: not named in the judge file\nHead: 7cdaa0b81e0231f27b6606d5910630c4fd4f5d91\n\nGoal file (goals/fetch-gate.md):\n\n# fetch-gate\n\nGoal: build the fetch gate of foundry ADR-0005 s11 in plugins/foundry/hooks/register.ts: export fetchVerdict with the signature pinned at plugins/foundry/docs/architecture.md:515-520, add the fetch member to FoundryEvent, and register a tool.call handler for WebFetch and WebSearch (shape of register.ts:1768, ending in .catch(failOpen)) that allows every call and logs one fetch line per points 1, 2 and 6.\n\nWave: 1. Verdict: change (module foundry: the stored event union gains fetch; the s11 no-allowlist path).\n\nDone-check:\n\n```\ntest -f plugins/foundry/tests/contract-fetch.test.ts && claude plugin test plugins/foundry && claude plugin validate plugins/foundry\n```\n\nOwns:\n- plugins/foundry/hooks/register.ts\n- plugins/foundry/tests/fetch.test.ts\n\nHigh-impact paths: plugins/foundry/hooks/register.ts.\n\nRed team: yes. Attack with a throwing $.fs; a slow fs past EVENT_WAIT_MS; a backlog past EVENT_BACKLOG_MAX; a missing url or query; a non-string input; a credentialed URL with a query and fragment; a 10,000-character query; a fetch from a session with no plan.json.\n\nArchitecture doc: docs/architecture.md (root, from .claude/foundry.json) and the foundry module doc plugins/foundry/docs/architecture.md (its \"Fetch gate (0.8.0)\", \"The extend pass (0.8.0)\" and \"Seams (0.8.0)\" sections, merged from wave 0). This run's ADR: plugins/foundry/docs/adr/0005-growth-model.md (foundry ADR-0005). Plan: plan.md and plan.json in this foundry dir; your crew's section of plan.md is the detailed work list.\n\nDone-check proved red at plan time only because wave 0 had not merged; wave 0 (growth-contract) is now merged on main at 2ee7f05. Re-run the done-check before any member starts; it must fail, for the missing feature.\n\nResources: no database; temp dir: the crew's worktree only. ports: none (no .claude/worktree-setup.*; worktrees gives no PORT_BASE).\n\nPrompt overrides: none\n\nMembers' reports named:\n- .git/truss/70917104-1578-48f5-8ac2-f9e48814b8cc/reports/fetch-gate/fetch-gate-builder.md\n\nDone-check output (as quoted by the judge file):\n- Builder proof (commit ac28806): 431 pass / 0 fail\n",
  "expected": {
    "keyword": "VERDICT",
    "kind": "PASS"
  }
}
