{
  "id": "cynic-answer-readonly-manifest",
  "source": ".git/foundry/40816bb1-1ec8-4755-8d97-0d12599e1e84/decisions.md",
  "role": "checker",
  "input": "Decision text: Design narrowing, kit's manifest the only read-only source: accepted; without kit, judge and cynic keep worktrees and the owner can set noIsolateAgents, which the worktrees README and foundry init must name.\nCitation: plan.md risk line; P11\n",
  "expected": {
    "keyword": "RECOMMEND",
    "kind": "answer"
  }
}
