{
  "id": "judge-prompts-1",
  "source": ".git/foundry/70917104-1578-48f5-8ac2-f9e48814b8cc/reports/prompts/prompts-judge.md",
  "role": "qc",
  "input": "Rule on the work of the crew \"prompts\" against its goal and done-check.\n\nBase: not named in the judge file\nHead: ce2fca874ce28cf74a8c942e1e102d20756e6e3e\n\nGoal file (goals/prompts.md):\n\n# prompts\n\nGoal: carry foundry ADR-0005 into foundry's prompts and docs: the s2 fetch rule word for word in all six agents/*.md and skills/run/SKILL.md; WebFetch and WebSearch for the architect and writer (s3); the architect's UNCOVERED: outcome, extend pass and domain section (s4, s5, point 3); lead.md's optional ## Learned, BLOCKED: on an open owner action, and the fetch rule in every member brief; the run skill's extend handling, ## Learned pass, separate commits and kit:revise pointer (s4, s5, s8, s10); init with a goal (s4); the README's 0.8.0 section, fetch log and retro keys; plugin.json version 0.8.0.\n\nWave: 1. Verdict: change (module foundry: default web tools for the architect and writer, the P9 break accepted with ADR-0005).\n\nDone-check:\n\n```\ngrep -q 'ADR-0005' plugins/foundry/tests/gates.check.ts && node --test plugins/foundry/tests/*.check.ts && claude plugin validate plugins/foundry && node -e \"const [a,b,c]=require('./plugins/foundry/.claude-plugin/plugin.json').version.split('.').map(Number);console.log('foundry',a,b,c);process.exit(a*1e6+b*1e3+c>=8000?0:1)\"\n```\n\nOwns:\n- plugins/foundry/agents/architect.md, writer.md, lead.md, judge.md, cynic.md, devops.md\n- plugins/foundry/skills/run/SKILL.md\n- plugins/foundry/skills/init/SKILL.md\n- plugins/foundry/README.md\n- plugins/foundry/.claude-plugin/plugin.json\n\nHigh-impact paths: plugins/foundry/agents/architect.md, plugins/foundry/skills/run/SKILL.md.\n\nRed team: no.\n\nArchitecture doc: docs/architecture.md (root, from .claude/foundry.json) and the foundry module doc plugins/foundry/docs/architecture.md (its \"Fetch gate (0.8.0)\", \"The extend pass (0.8.0)\" and \"Seams (0.8.0)\" sections, merged from wave 0). This run's ADR: plugins/foundry/docs/adr/0005-growth-model.md (foundry ADR-0005). Plan: plan.md and plan.json in this foundry dir; your crew's section of plan.md is the detailed work list.\n\nDone-check proved red at plan time only because wave 0 had not merged; wave 0 (growth-contract) is now merged on main at 2ee7f05. Re-run the done-check before any member starts; it must fail, for the missing feature.\n\nResources: no database; temp dir: the crew's worktree only. ports: none (no .claude/worktree-setup.*; worktrees gives no PORT_BASE).\n\nPrompt overrides: none\n\nMembers' reports named:\n- .git/truss/70917104-1578-48f5-8ac2-f9e48814b8cc/reports/prompts/prompts-writer-rest.md\n\nDone-check output (as quoted by the judge file):\n- Members' whole-suite numbers: 130 pass / 8 fail each\n- Lead's `claude plugin test`: 410/16\n- Lead's unittest result: 10 failures\n",
  "expected": {
    "keyword": "VERDICT",
    "kind": "FAIL"
  }
}
