{
  "id": "judge-worktrees-repair-1",
  "source": ".git/foundry/40816bb1-1ec8-4755-8d97-0d12599e1e84/reports/worktrees-repair/worktrees-repair-judge.md",
  "role": "qc",
  "input": "Rule on the work of the crew \"worktrees-repair\" against its goal and done-check.\n\nBase: not named in the judge file\nHead: 31eefe5ae5d1dde631c28c2dc31a807a54771b7f\n\nGoal file (goals/worktrees-repair.md):\n\n# Crew `worktrees-repair` (wave 2, verdict `change`, mid-run design slice approved by the owner)\n\n**Why this crew exists.** worktrees 0.8.0 (crew `worktrees-cleanup`, branch `worktree-agent-a7aa953ce880a0425` at 7875f5b) went to main and was pulled again at 5f804ce. With real git its merge sweep did two things wrong:\n\n1. **It destroyed a live lead.** The e2e lead ran `git merge --no-ff <writer branch>`, then ended its turn to wait for its test-writer, so Claude Code wrote `finished: true` to its `subagents/agent-<id>.meta.json`. A sweep then ran with the writer's checkout as a ref. It was set off by the writer's commit message, because `register.ts:1727` matches `\\bmerge\\b` anywhere in a command. The lead's merge commit 1d31602 has the same tree as the writer's HEAD 4290876 (f49503e7). That made `mergedBy = 'tree'`, and `decideSelfClean` (`register.ts:590-596`) chose `worktree remove` plus `branch -D`. The lead's work survives on branch `e2e-lead-rescue`.\n2. **It orphans member branches.** A sweep in the crew worktree removes the member's worktree, then runs `git branch -d <member>` in the main checkout (`register.ts:1191`). That refuses, because main hasn't fast-forwarded yet. The worktree is gone, so no later sweep finds the branch. The proof is `tests/e2e/cleanup.e2e.ts` on branch `worktree-agent-a3e0533489a493a58` at df997bf, which fails 2 of 2 against 0.8.0. Its report is `reports/e2e/e2e-tester.md`.\n\n**Goal.** Rebuild worktrees 0.8.x so that neither can happen, after amending ADR-0015 to say so. The run's goal is in `plan.json`.\n\n**Step 1, the ADR amendment** (architect, `foundry:architect` in `design` mode, Opus, medium). It amends `docs/adr/0015-agent-worktree-cleanup.md` with a dated amendment section, not a rewrite. The owner approved these four points; the architect decides how, not whether:\n\n- (a) **A lead with members still running is live, whatever its own meta says.** A finished meta alone is not proof an agent is done when it can be resumed: a background lead's turn ends every time it waits. The ADR names the signal the sweep can read, and says what happens when that signal can't be read (fail safe: keep).\n- (b) **Merge evidence from the candidate's own crew never earns a force delete.** Any ref that is the candidate's own member, or descends from its crew branch, cannot prove the candidate merged by tree or cherry. The rule for `-d` versus `-D` must say which refs may earn `-D`, if any.\n- (c) **The sweep fires only on a real `git merge` command** (including `git -C <dir> merge`, and `merge` as the git subcommand after options), never on the word appearing in a heredoc, commit message, or `merge-base`/`merge-tree`.\n- (d) **A member branch is deleted only once the main checkout's HEAD contains it.** Until then the worktree is kept, so a later sweep (after the foreman's `--ff-only`) finds it again. A branch is never orphaned.\n\nThe architect also records RT5-1, the slots.json-unreadable window, as an open question, and nothing more.\n\n**Step 2, contract tests** (test-writer, `kit:test-writer`, Sonnet, medium, after the ADR amendment, before the builder). New file `plugins/worktrees/tests/contract-repair.test.ts`, in the style of `contract-cleanup.test.ts`, with one case for each of (a)-(d). It must include the exact e2e-lead scenario from item 1 above as a mock world: lead finished with a member running, the member's checkout as ref, same tree, so no remove. Edit an existing case in `contract-cleanup.test.ts` only where the amendment changes what it asserts. Each changed case gets a comment citing the amendment point, and the judge checks every one of them.\n\n**Step 3, the build** (builder, `kit:builder`, Sonnet, medium):\n\n- Start the crew branch from main (5f804ce). Bring 0.8.0 back with `git revert --no-edit 5f804ce`, then `git merge --no-ff worktree-agent-a3e0533489a493a58` to bring in the e2e test. Both are deterministic and the lead runs them as commands.\n- Then change `plugins/worktrees/hooks/register.ts` (`decideSelfClean`, `mergedBy`, `selfClean` ~1115-1211, the PostToolUse trigger ~1723) to the amended ADR.\n- Also fix RT6-1: in `loadState`, move the read inside its `try` (~902-905).\n- Update the README and bump the version to 0.8.1 or above.\n\n**Ownership rule for the e2e test.** `tests/e2e/cleanup.e2e.ts` belongs to crew `e2e`. This crew merges it in as an input and never edits it. The judge checks that `git diff df997bf HEAD -- tests/e2e` is empty.\n\n**Done-check** (red now: on main `tests/e2e/cleanup.e2e.ts` doesn't exist; after step 3's revert and merge it is 2/2 red per the e2e tester):\n\n```\nnode --test tests/e2e/cleanup.e2e.ts && test -f plugins/worktrees/tests/contract-repair.test.ts && claude plugin test plugins/worktrees && claude plugin validate plugins/worktrees && node -e \"const [a,b,c]=require('./plugins/worktrees/.claude-plugin/plugin.json').version.split('.').map(Number);console.log('worktrees',a,b,c);process.exit(a*1e6+b*1e3+c>8000?0:1)\"\n```\n\n**Owns:**\n\n- `docs/adr/0015-agent-worktree-cleanup.md` (architect only)\n- `plugins/worktrees/hooks/**`\n- `plugins/worktrees/tests/**` (the test-writer owns the contract files; the builder may edit `hooks.test.ts`, `logic.test.ts` and `contract.test.ts` mocks only)\n- `plugins/worktrees/README.md`, `plugins/worktrees/.claude-plugin/plugin.json`\n\n**Must not touch:** `tests/e2e/**` (it comes in by merge only), `plugins/foundry/**`, the root `README.md`, and every other doc.\n\n**High-impact paths:** `selfClean`, `decideSelfClean`, `mergedBy`, `removeWorktree`, `tidy`, the PostToolUse trigger. **Red team: yes, ONE round only** (`foundry:judge` in red-team mode, Opus, medium), run after the build. It must try:\n\n- the e2e-lead scenario with real git in a temp repo;\n- a lead whose only member is still running;\n- a member ref with the same tree as its lead;\n- `merge` in a heredoc, a commit message and `git merge-base`;\n- `git -C x merge`;\n- a member merged into the crew branch but not yet into main, then main fast-forwarded.\n\nFix only the high findings that are code bugs against the amended ADR. Defer the rest.\n\n**Judge checks:** the ADR amendment states (a)-(d) and no more; every changed contract-cleanup case cites the amendment; tests/e2e unchanged from df997bf; no `fetch`/`pull`/`push`/`update-ref`/`--ff-only`/`--force` remove in the sweep; `REFUSED_READ_ONLY_TYPES` unchanged; no `skip`/`todo`.\n\n**Members** (planned, 6 including the lead): architect, test-writer, builder, one red team, judge. If a Sonnet member fails the same task twice, follow lead.md §7.\n\n**Resources:** temp git repos via `mkdtemp` only, never this repo. ports: none (no .claude/worktree-setup.*; worktrees gives no PORT_BASE).\n\n**ADRs:** `docs/adr/0015-agent-worktree-cleanup.md`, `docs/adr/0006-shared-state-in-git-common-dir.md`, `docs/adr/0014-worktrees-declared-read-only-agents.md`.\n\nPrompt overrides: none\n\nMembers' reports named: none.\n\nDone-check output (as quoted by the judge file):\n- Test-writer's red-before-build run at ae07d83: 150/15\n",
  "expected": {
    "keyword": "VERDICT",
    "kind": "PASS"
  }
}
