{
  "id": "judge-redteam-reset",
  "source": ".git/foundry/70917104-1578-48f5-8ac2-f9e48814b8cc/reports/redteam-reset/redteam-reset-judge.md",
  "role": "qc",
  "input": "Rule on the work of the crew \"redteam-reset\" against its goal and done-check.\n\nBase: not named in the judge file\nHead: 65cc2b6fbe2d7fabe3b21ad6d5f4e3269565b1d8\n\nGoal file (goals/redteam-reset.md):\n\n# redteam-reset\n\nGoal: the red team keeps its worktree on its `worktree-agent-<id>` branch and leaves it clean, so worktrees self-clean removes it with `-d` once the crew merges. In `plugins/foundry/agents/judge.md` red-team mode (line 78), replace `git checkout --detach <sha>` with `git reset --hard <sha>` in its own worktree. Add the end state from foundry ADR-0006: before reporting, run `git reset --hard <sha>` again and `git clean -fd` in its own worktree; confirm `git status --porcelain --untracked-files=all` prints nothing; never commit, even when the worktrees hook says to, and discard instead; prefer temp dirs for probes. In `plugins/foundry/agents/lead.md:64`, the red-team bullet no longer says the red team \"checks out\" the SHA. Also: the README entry for all three items of this run (the red-team change; retro's new `leftoverDetails` key and the CAUSE root-cause step, both taken from ADR-0006 and goals/retro-causes.md, not from retro-causes' unmerged branch), including the stale \"checks out the crew head SHA there itself\" at README.md:154. And the version bump of plugins/foundry from 0.8.0 to 0.9.0 in plugin.json.\n\nWave: 1. Verdict: extend (module crew agents).\n\nDone-check:\n\n```\nnode --test plugins/foundry/tests/redteam-reset.check.ts\n```\n\nIt is proved red only after wave 0 (leftover-design) merges. The lead re-runs it first, and it must fail on the `git checkout --detach` literal still at judge.md:78.\n\nOwns:\n- plugins/foundry/agents/judge.md\n- plugins/foundry/agents/lead.md\n- plugins/foundry/README.md\n- plugins/foundry/.claude-plugin/plugin.json\n\nMust not touch: retro.py, the retro SKILL.md, the contract tests, ADRs and architecture docs. No worktrees plugin change.\n\nHigh-impact paths: plugins/foundry/agents/judge.md red-team mode.\n\nRed team: no.\n\nResources: none needed. ports: none (no .claude/worktree-setup.*; worktrees gives no PORT_BASE).\n\nArchitecture doc: docs/architecture.md and plugins/foundry/docs/architecture.md. This run's ADR: plugins/foundry/docs/adr/0006-leftover-causes.md (foundry ADR-0006). Plan: plan.md and plan.json in this foundry dir.\n\nPrompt overrides: none\n\nMembers' reports named: none.\n\nDone-check output (as quoted by the judge file):\n- Builder proof (commit 15737ed): done-check 9 pass, `grep -c \"git checkout --detach\"` = 0, plugin validates\n- Lead's full-suite numbers: 14 node failures and 27 unittest failures\n",
  "expected": {
    "keyword": "VERDICT",
    "kind": "PASS"
  }
}
